{
  "format": "chunkflow-transcript",
  "version": 1,
  "audio": {
    "fileName": "russian01.mp3",
    "sha256": "0000000000000000000000000000000000000000000000000000000000c0fff3",
    "durationMs": 20000
  },
  "languages": {
    "target": "ru",
    "base": "en"
  },
  "generator": {
    "tool": "chunkflow-transcribe 0.1.0",
    "engine": "faster-whisper 1.1.1",
    "model": "large-v3-turbo",
    "createdAt": "2026-10-14T12:00:00Z"
  },
  "segments": [
    {
      "startMs": 700,
      "endMs": 2400,
      "lang": "en",
      "langProb": 0.99,
      "text": "Listen and repeat."
    },
    {
      "startMs": 3000,
      "endMs": 4900,
      "lang": "ru",
      "langProb": 0.98,
      "text": "Здравствуйте! Как дела?"
    }
  ]
}
