{
  "format": "chunkflow-transcript",
  "version": 1,
  "audio": {
    "fileName": "podcast01.mp3",
    "sha256": "0000000000000000000000000000000000000000000000000000000000c0fff6",
    "durationMs": 20000
  },
  "languages": {
    "target": "es"
  },
  "generator": {
    "tool": "chunkflow-transcribe 0.1.0",
    "engine": "faster-whisper 1.1.1",
    "model": "large-v3-turbo",
    "createdAt": "2026-10-14T12:00:00Z"
  },
  "segments": [
    {
      "startMs": 500,
      "endMs": 2600,
      "lang": "es",
      "text": "¿Dónde está la estación?",
      "words": [
        {
          "startMs": 500,
          "endMs": 1100,
          "text": "¿Dónde",
          "prob": 0.95
        },
        {
          "startMs": 1150,
          "endMs": 1500,
          "text": "está",
          "prob": 0.95
        },
        {
          "startMs": 1550,
          "endMs": 1800,
          "text": "la",
          "prob": 0.95
        },
        {
          "startMs": 1850,
          "endMs": 2600,
          "text": "estación?",
          "prob": 0.95
        }
      ]
    },
    {
      "startMs": 3200,
      "endMs": 5800,
      "lang": "es",
      "text": "Está a la derecha.",
      "langProb": 1.0
    }
  ]
}
