{
  "format": "chunkflow-transcript",
  "version": 1,
  "audio": {
    "fileName": "hindi01.mp3",
    "sha256": "0000000000000000000000000000000000000000000000000000000000c0fff2",
    "durationMs": 20000
  },
  "languages": {
    "target": "hi",
    "base": "en"
  },
  "generator": {
    "tool": "chunkflow-transcribe 0.1.0",
    "engine": "faster-whisper 1.1.1",
    "model": "large-v3-turbo",
    "createdAt": "2026-10-14T12:00:00Z"
  },
  "segments": [
    {
      "startMs": 800,
      "endMs": 2600,
      "lang": "en",
      "langProb": 0.99,
      "text": "Repeat after me."
    },
    {
      "startMs": 3300,
      "endMs": 5400,
      "lang": "hi",
      "langProb": 0.96,
      "text": "नमस्ते, आप कैसे हैं?"
    },
    {
      "startMs": 6100,
      "endMs": 8700,
      "lang": "hi",
      "langProb": 0.95,
      "text": "मुझे हिंदी सीखना पसंद है।"
    }
  ]
}
