{
  "format": "chunkflow-transcript",
  "version": 1,
  "audio": {
    "fileName": "lesson01.mp3",
    "sha256": "0000000000000000000000000000000000000000000000000000000000c0fff0",
    "durationMs": 30000
  },
  "languages": {
    "target": "zh",
    "base": "ja"
  },
  "generator": {
    "tool": "chunkflow-transcribe 0.1.0",
    "engine": "mlx-whisper 0.4.2",
    "model": "large-v3-turbo",
    "createdAt": "2026-10-14T12:00:00Z"
  },
  "segments": [
    {
      "startMs": 1000,
      "endMs": 2700,
      "lang": "ja",
      "langProb": 0.99,
      "text": "では、聞いてみましょう。"
    },
    {
      "startMs": 3200,
      "endMs": 5470,
      "lang": "zh",
      "langProb": 0.97,
      "text": "你们好，欢迎来到北京。",
      "textVariants": {
        "Hant": "你們好，歡迎來到北京。"
      },
      "words": [
        {
          "startMs": 3200,
          "endMs": 3980,
          "text": "你们好，",
          "prob": 0.95
        },
        {
          "startMs": 4110,
          "endMs": 4620,
          "text": "欢迎",
          "prob": 0.93
        },
        {
          "startMs": 4690,
          "endMs": 5470,
          "text": "来到北京。",
          "prob": 0.96
        }
      ]
    },
    {
      "startMs": 6300,
      "endMs": 8100,
      "lang": "zh",
      "langProb": 0.95,
      "text": "这个多少钱？",
      "textVariants": {
        "Hant": "這個多少錢？"
      }
    }
  ]
}
