{
  "format": "chunkflow-transcript",
  "version": 1,
  "audio": {
    "fileName": "vietnamese01.mp3",
    "sha256": "0000000000000000000000000000000000000000000000000000000000c0fff4",
    "durationMs": 20000
  },
  "languages": {
    "target": "vi",
    "base": "en"
  },
  "generator": {
    "tool": "chunkflow-transcribe 0.1.0",
    "engine": "faster-whisper 1.1.1",
    "model": "large-v3-turbo",
    "createdAt": "2026-10-14T12:00:00Z"
  },
  "segments": [
    {
      "startMs": 600,
      "endMs": 2300,
      "lang": "en",
      "langProb": 0.99,
      "text": "How do you greet someone?"
    },
    {
      "startMs": 3000,
      "endMs": 4800,
      "lang": "vi",
      "langProb": 0.97,
      "text": "Xin chào, bạn khỏe không?"
    }
  ]
}
