{
  "format": "chunkflow-transcript",
  "version": 1,
  "audio": {
    "fileName": "silence.mp3",
    "sha256": "0000000000000000000000000000000000000000000000000000000000c0fff8",
    "durationMs": 5000
  },
  "languages": {
    "target": "ko",
    "base": "ja"
  },
  "generator": {
    "tool": "chunkflow-transcribe 0.1.0",
    "engine": "faster-whisper 1.1.1",
    "model": "large-v3-turbo",
    "createdAt": "2026-10-14T12:00:00Z"
  },
  "segments": []
}
