{
  "format": "chunkflow-transcript",
  "version": 1,
  "audio": {
    "fileName": "greek01.mp3",
    "sha256": "0000000000000000000000000000000000000000000000000000000000c0fff5",
    "durationMs": 20000
  },
  "languages": {
    "target": "el",
    "base": "en"
  },
  "generator": {
    "tool": "chunkflow-transcribe 0.1.0",
    "engine": "faster-whisper 1.1.1",
    "model": "large-v3-turbo",
    "createdAt": "2026-10-14T12:00:00Z"
  },
  "segments": [
    {
      "startMs": 700,
      "endMs": 2200,
      "lang": "en",
      "langProb": 0.99,
      "text": "Good morning in Greek."
    },
    {
      "startMs": 2900,
      "endMs": 4600,
      "lang": "el",
      "langProb": 0.97,
      "text": "Καλημέρα! Τι κάνεις;"
    }
  ]
}
